Titre;Chapitre;Section;Article;Décret;Contenu;Numéro Décret;Date decret;Annee decret
Titre II : Obligations de l'employeur pour l'utilisation des lieux de travail  (Articles R4221-1 à R4228-37);Chapitre III : Éclairage, ambiance thermique (Articles R4223-1 à R4223-15);Section 1 : Éclairage (Articles R4223-1 à R4223-12);Article R4223-11;Modifié par Décret n°2017-1819 du 29 décembre 2017 - art. 3;"Le matériel d'éclairage est installé de manière à pouvoir être entretenu aisément.
L'employeur fixe les règles d'entretien périodique du matériel en vue d'assurer le respect des dispositions de la présente section.
Les règles d'entretien sont consignées dans un document qui est communiqué aux membres du                    comité social et économique.";2017-1819;2017-12-29;2017
Titre II : Obligations de l'employeur pour l'utilisation des lieux de travail  (Articles R4221-1 à R4228-37);Chapitre III : Éclairage, ambiance thermique (Articles R4223-1 à R4223-15);Section 1 : Éclairage (Articles R4223-1 à R4223-12);Article R4223-12;Création Décret n°2008-244 du 7 mars 2008 - art. (V);"Les dispositions des articles
R. 4223-6
,
R. 4223-7
,
R. 4223-8
, premier alinéa, et
R. 4223-10
ne sont pas applicables aux opérations de bâtiment et de génie civil définies à l'article
R. 4534-1
.";2008-244;2008-03-07;2008
Titre II : Obligations de l'employeur pour l'utilisation des lieux de travail  (Articles R4221-1 à R4228-37);Chapitre III : Éclairage, ambiance thermique (Articles R4223-1 à R4223-15);Section 2 : Ambiance thermique (Articles R4223-13 à R4223-15);Article R4223-13;Création Décret n°2008-244 du 7 mars 2008 - art. (V);"Les locaux fermés affectés au travail sont chauffés pendant la saison froide.
Le chauffage fonctionne de manière à maintenir une température convenable et à ne donner lieu à aucune émanation délétère.";2008-244;2008-03-07;2008
Titre II : Obligations de l'employeur pour l'utilisation des lieux de travail  (Articles R4221-1 à R4228-37);Chapitre III : Éclairage, ambiance thermique (Articles R4223-1 à R4223-15);Section 2 : Ambiance thermique (Articles R4223-13 à R4223-15);Article R4223-14;Création Décret n°2008-244 du 7 mars 2008 - art. (V);La température des locaux annexes, tels que locaux de restauration, locaux de repos, locaux pour les travailleurs en service de permanence, locaux sanitaires et locaux de premiers secours, obéit à la destination spécifique de ces locaux.;2008-244;2008-03-07;2008
Titre II : Obligations de l'employeur pour l'utilisation des lieux de travail  (Articles R4221-1 à R4228-37);Chapitre III : Éclairage, ambiance thermique (Articles R4223-1 à R4223-15);Section 2 : Ambiance thermique (Articles R4223-13 à R4223-15);Article R4223-15;Modifié par Décret n°2017-1819 du 29 décembre 2017 - art. 3;L'employeur prend, après avis du médecin du travail et du                    comité social et économique, toutes dispositions nécessaires pour assurer la protection des travailleurs contre le froid et les intempéries.;2017-1819;2017-12-29;2017
Titre II : Obligations de l'employeur pour l'utilisation des lieux de travail  (Articles R4221-1 à R4228-37);Chapitre IV : Sécurité des lieux de travail (Articles R4224-1 à R4224-24);Section 1 : Caractéristiques des lieux de travail (Articles R4224-1 à R4224-8);Article R4224-1;Création Décret n°2008-244 du 7 mars 2008 - art. (V);"Les lieux de travail soumis aux dispositions du titre Ier lors de leur construction ou de leur aménagement sont utilisés en conformité avec ces dispositions.
En cas de changement de destination, ils sont aménagés pour être rendus conformes aux dispositions régissant cette nouvelle destination à la date des travaux d'aménagement.";2008-244;2008-03-07;2008
Titre II : Obligations de l'employeur pour l'utilisation des lieux de travail  (Articles R4221-1 à R4228-37);Chapitre IV : Sécurité des lieux de travail (Articles R4224-1 à R4224-24);Section 1 : Caractéristiques des lieux de travail (Articles R4224-1 à R4224-8);Article R4224-2;Création Décret n°2008-244 du 7 mars 2008 - art. (V);Les bâtiments abritant des lieux de travail ont des structures et une solidité appropriées à leur utilisation.;2008-244;2008-03-07;2008
Titre II : Obligations de l'employeur pour l'utilisation des lieux de travail  (Articles R4221-1 à R4228-37);Chapitre IV : Sécurité des lieux de travail (Articles R4224-1 à R4224-24);Section 1 : Caractéristiques des lieux de travail (Articles R4224-1 à R4224-8);Article R4224-3;Création Décret n°2008-244 du 7 mars 2008 - art. (V);Les lieux de travail intérieurs et extérieurs sont aménagés de telle façon que la circulation des piétons et des véhicules puisse se faire de manière sûre.;2008-244;2008-03-07;2008
Titre II : Obligations de l'employeur pour l'utilisation des lieux de travail  (Articles R4221-1 à R4228-37);Chapitre IV : Sécurité des lieux de travail (Articles R4224-1 à R4224-24);Section 1 : Caractéristiques des lieux de travail (Articles R4224-1 à R4224-8);Article R4224-4;Création Décret n°2008-244 du 7 mars 2008 - art. (V);L'employeur prend toutes dispositions pour que seuls les travailleurs autorisés à cet effet puissent accéder aux zones de danger. Les mesures appropriées sont prises pour protéger ces travailleurs.;2008-244;2008-03-07;2008
Titre II : Obligations de l'employeur pour l'utilisation des lieux de travail  (Articles R4221-1 à R4228-37);Chapitre IV : Sécurité des lieux de travail (Articles R4224-1 à R4224-24);Section 1 : Caractéristiques des lieux de travail (Articles R4224-1 à R4224-8);Article R4224-5;"Modifié par Décret n°2009-289
 du 13 mars 2009 - art. 4";"Les puits, trappes et ouvertures de descente sont clôturés.
Les passerelles, planchers en encorbellement, plates-formes en surélévation, ainsi que leurs moyens d'accès, sont construits, installés ou protégés de telle sorte que les travailleurs appelés à les utiliser ne soient pas exposés à des chutes.";2009-289;2009-03-13;2009
Titre II : Obligations de l'employeur pour l'utilisation des lieux de travail  (Articles R4221-1 à R4228-37);Chapitre IV : Sécurité des lieux de travail (Articles R4224-1 à R4224-24);Section 1 : Caractéristiques des lieux de travail (Articles R4224-1 à R4224-8);Article R4224-6;Création Décret n°2008-244 du 7 mars 2008 - art. (V);Les ponts volants ou les passerelles pour le chargement ou le déchargement des navires ou bateaux sont installés de manière à former un tout rigide et sont munis de garde-corps des deux côtés.;2008-244;2008-03-07;2008
Titre II : Obligations de l'employeur pour l'utilisation des lieux de travail  (Articles R4221-1 à R4228-37);Chapitre IV : Sécurité des lieux de travail (Articles R4224-1 à R4224-24);Section 1 : Caractéristiques des lieux de travail (Articles R4224-1 à R4224-8);Article R4224-7;Création Décret n°2008-244 du 7 mars 2008 - art. (V);"Les cuves, bassins et réservoirs sont construits, installés et protégés dans les conditions assurant la sécurité des travailleurs.
Leur installation ou, à défaut, leurs dispositifs de protection sont tels qu'ils empêchent les travailleurs d'y tomber.";2008-244;2008-03-07;2008
Titre II : Obligations de l'employeur pour l'utilisation des lieux de travail  (Articles R4221-1 à R4228-37);Chapitre IV : Sécurité des lieux de travail (Articles R4224-1 à R4224-24);Section 1 : Caractéristiques des lieux de travail (Articles R4224-1 à R4224-8);Article R4224-8;Création Décret n°2008-244 du 7 mars 2008 - art. (V);"L'accès et l'intervention sur les toits en matériaux fragiles n'offrant pas une résistance suffisante sont effectués conformément aux articles
R. 4534-88
,
R. 4534-89
et
R. 4534-93
applicables aux opérations de bâtiment et de génie civil.";2008-244;2008-03-07;2008
Titre II : Obligations de l'employeur pour l'utilisation des lieux de travail  (Articles R4221-1 à R4228-37);Chapitre IV : Sécurité des lieux de travail (Articles R4224-1 à R4224-24);Section 2 : Portes et portails (Articles R4224-9 à R4224-13);Article R4224-9;Création Décret n°2008-244 du 7 mars 2008 - art. (V);Les portes et portails en va-et-vient sont transparents ou possèdent des panneaux transparents.;2008-244;2008-03-07;2008
Titre II : Obligations de l'employeur pour l'utilisation des lieux de travail  (Articles R4221-1 à R4228-37);Chapitre IV : Sécurité des lieux de travail (Articles R4224-1 à R4224-24);Section 2 : Portes et portails (Articles R4224-9 à R4224-13);Article R4224-10;Création Décret n°2008-244 du 7 mars 2008 - art. (V);Les parties transparentes sont constituées de matériaux de sécurité ou protégées contre l'enfoncement de sorte que les travailleurs ne puissent être blessés en cas de bris de ces surfaces.;2008-244;2008-03-07;2008
Titre II : Obligations de l'employeur pour l'utilisation des lieux de travail  (Articles R4221-1 à R4228-37);Chapitre IV : Sécurité des lieux de travail (Articles R4224-1 à R4224-24);Section 2 : Portes et portails (Articles R4224-9 à R4224-13);Article R4224-11;Création Décret n°2008-244 du 7 mars 2008 - art. (V);"Les portes et portails coulissants sont munis d'un système de sécurité les empêchant de sortir de leur rail et de tomber.
Les portes et portails s'ouvrant vers le haut sont munis d'un système de sécurité les empêchant de retomber.";2008-244;2008-03-07;2008
Titre II : Obligations de l'employeur pour l'utilisation des lieux de travail  (Articles R4221-1 à R4228-37);Chapitre IV : Sécurité des lieux de travail (Articles R4224-1 à R4224-24);Section 2 : Portes et portails (Articles R4224-9 à R4224-13);Article R4224-12;Création Décret n°2008-244 du 7 mars 2008 - art. (V);"Les portes et portails sont entretenus et contrôlés régulièrement.
Lorsque leur chute peut présenter un danger pour les travailleurs, notamment en raison de leurs dimensions, de leur poids ou de leur mode de fixation, la périodicité des contrôles et les interventions sont consignées dans le dossier prévu à l'article
R. 4224-17
.";2008-244;2008-03-07;2008
Titre II : Obligations de l'employeur pour l'utilisation des lieux de travail  (Articles R4221-1 à R4228-37);Chapitre IV : Sécurité des lieux de travail (Articles R4224-1 à R4224-24);Section 2 : Portes et portails (Articles R4224-9 à R4224-13);Article R4224-13;Création Décret n°2008-244 du 7 mars 2008 - art. (V);"Les portes et portails automatiques fonctionnent sans risque d'accident pour les travailleurs.
Les caractéristiques auxquelles obéissent les installations nouvelles et existantes de portes et portails automatiques ainsi que leurs conditions de maintenance et de vérification sont définies par arrêté conjoint des ministres chargés du travail et de l'agriculture.";2008-244;2008-03-07;2008
Titre II : Obligations de l'employeur pour l'utilisation des lieux de travail  (Articles R4221-1 à R4228-37);Chapitre IV : Sécurité des lieux de travail (Articles R4224-1 à R4224-24);Section 3 : Matériel de premier secours et secouriste (Articles R4224-14 à R4224-16);Article R4224-14;Création Décret n°2008-244 du 7 mars 2008 - art. (V);Les lieux de travail sont équipés d'un matériel de premiers secours adapté à la nature des risques et facilement accessible.;2008-244;2008-03-07;2008
Titre II : Obligations de l'employeur pour l'utilisation des lieux de travail  (Articles R4221-1 à R4228-37);Chapitre IV : Sécurité des lieux de travail (Articles R4224-1 à R4224-24);Section 3 : Matériel de premier secours et secouriste (Articles R4224-14 à R4224-16);Article R4224-15;Création Décret n°2008-244 du 7 mars 2008 - art. (V);"Un membre du personnel reçoit la formation de secouriste nécessaire pour donner les premiers secours en cas d'urgence dans :
1° Chaque atelier où sont accomplis des travaux dangereux ;
2° Chaque chantier employant vingt travailleurs au moins pendant plus de quinze jours où sont réalisés des travaux dangereux.
Les travailleurs ainsi formés ne peuvent remplacer les infirmiers.";2008-244;2008-03-07;2008
Titre II : Obligations de l'employeur pour l'utilisation des lieux de travail  (Articles R4221-1 à R4228-37);Chapitre IV : Sécurité des lieux de travail (Articles R4224-1 à R4224-24);Section 3 : Matériel de premier secours et secouriste (Articles R4224-14 à R4224-16);Article R4224-16;Modifié par Décret n°2021-143 du 10 février 2021 - art. 10;"En l'absence d'infirmiers, ou lorsque leur nombre ne permet pas d'assurer une présence permanente, l'employeur prend, après avis du médecin du travail, les mesures nécessaires pour assurer les premiers secours aux accidentés et aux malades. Ces mesures qui sont prises en liaison notamment avec les services de secours d'urgence extérieurs à l'entreprise sont adaptées à la nature des risques.
Ces mesures sont consignées dans un document tenu à la disposition de l'agent de contrôle de l'inspection du travail.";2021-143;2021-02-10;2021
Titre II : Obligations de l'employeur pour l'utilisation des lieux de travail  (Articles R4221-1 à R4228-37);Chapitre IV : Sécurité des lieux de travail (Articles R4224-1 à R4224-24);Section 4 : Maintenance, entretien et vérifications (Articles R4224-17 à R4224-19);Article R4224-17;Création Décret n°2008-244 du 7 mars 2008 - art. (V);"Les installations et dispositifs techniques et de sécurité des lieux de travail sont entretenus et vérifiés suivant une périodicité appropriée.
Toute défectuosité susceptible d'affecter la santé et la sécurité des travailleurs est éliminée le plus rapidement possible.
La périodicité des contrôles et les interventions sont consignées dans un dossier qui est, le cas échéant, annexé au dossier de maintenance des lieux de travail prévu à l'article
R. 4211-3
. Ce dossier regroupe notamment la consigne et les documents prévus en matière d'aération, d'assainissement et d'éclairage aux articles
R. 4222-21
et
R. 4223-11
.";2008-244;2008-03-07;2008
Titre II : Obligations de l'employeur pour l'utilisation des lieux de travail  (Articles R4221-1 à R4228-37);Chapitre IV : Sécurité des lieux de travail (Articles R4224-1 à R4224-24);Section 4 : Maintenance, entretien et vérifications (Articles R4224-17 à R4224-19);Article R4224-17-1;Modifié par Décret n°2021-872 du 30 juin 2021 - art. 7;"Lorsqu'un ou plusieurs ascenseurs sont en service dans les locaux d'un établissement, l'employeur s'assure que le propriétaire prend les mesures nécessaires pour se conformer :
1° Aux dispositions des
articles R. 134-6 à R. 134-13 du code de la construction et de l'habitation
relatives à l'entretien et au contrôle technique ;
2° Aux dispositions des
articles R. 134-2 à R. 134-5 du code de la construction et de l'habitation
relatives à la mise en sécurité des ascenseurs.
Le propriétaire met à la disposition de l'employeur les informations nécessaires.";2021-872;2021-06-30;2021
Titre II : Obligations de l'employeur pour l'utilisation des lieux de travail  (Articles R4221-1 à R4228-37);Chapitre IV : Sécurité des lieux de travail (Articles R4224-1 à R4224-24);Section 4 : Maintenance, entretien et vérifications (Articles R4224-17 à R4224-19);Article R4224-17-2;"Création Décret n°2008-1325
 du 15 décembre 2008 - art. 2";L'employeur informe le propriétaire de tout défaut de fonctionnement d'un ascenseur susceptible d'affecter la sécurité des personnes et prend les mesures nécessaires pour interdire l'utilisation de l'équipement tant qu'il n'a pas été remédié à ce défaut.;2008-1325;2008-12-15;2008
Titre II : Obligations de l'employeur pour l'utilisation des lieux de travail  (Articles R4221-1 à R4228-37);Chapitre IV : Sécurité des lieux de travail (Articles R4224-1 à R4224-24);Section 4 : Maintenance, entretien et vérifications (Articles R4224-17 à R4224-19);Article R4224-18;Modifié par Décret n°2017-1819 du 29 décembre 2017 - art. 3;"Les locaux de travail et leurs annexes sont régulièrement entretenus et nettoyés. Ils sont exempts de tout encombrement.
Le médecin du travail et le                     comité social et économique, émettent un avis sur les mesures à prendre pour satisfaire à ces obligations.";2017-1819;2017-12-29;2017
Titre II : Obligations de l'employeur pour l'utilisation des lieux de travail  (Articles R4221-1 à R4228-37);Chapitre IV : Sécurité des lieux de travail (Articles R4224-1 à R4224-24);Section 4 : Maintenance, entretien et vérifications (Articles R4224-17 à R4224-19);Article R4224-19;Création Décret n°2008-244 du 7 mars 2008 - art. (V);Lorsque l'entreprise quitte les locaux, l'employeur restitue le dossier de maintenance des lieux de travail au propriétaire ou le transmet à l'occupant suivant.;2008-244;2008-03-07;2008
Titre II : Obligations de l'employeur pour l'utilisation des lieux de travail  (Articles R4221-1 à R4228-37);Chapitre IV : Sécurité des lieux de travail (Articles R4224-1 à R4224-24);Section 5 : Signalisation et matérialisation  relatives à la santé et à la sécurité (Articles R4224-20 à R4224-24);Article R4224-20;Création Décret n°2008-244 du 7 mars 2008 - art. (V);"Lorsqu'il n'est pas possible, compte tenu de la nature du travail, d'éviter des zones de danger comportant notamment des risques de chute de personnes ou des risques de chute d'objets, et même s'il s'agit d'activités ponctuelles d'entretien ou de réparation, ces zones sont signalées de manière visible.
Elles sont également matérialisées par des dispositifs destinés à éviter que les travailleurs non autorisés pénètrent dans ces zones.";2008-244;2008-03-07;2008
Titre II : Obligations de l'employeur pour l'utilisation des lieux de travail  (Articles R4221-1 à R4228-37);Chapitre IV : Sécurité des lieux de travail (Articles R4224-1 à R4224-24);Section 5 : Signalisation et matérialisation  relatives à la santé et à la sécurité (Articles R4224-20 à R4224-24);Article R4224-21;Création Décret n°2008-244 du 7 mars 2008 - art. (V);Lorsque le contenu transporté par les tuyauteries présente un danger, ces tuyauteries font l'objet d'une signalisation permettant de déterminer la nature du contenu transporté.;2008-244;2008-03-07;2008
Titre II : Obligations de l'employeur pour l'utilisation des lieux de travail  (Articles R4221-1 à R4228-37);Chapitre IV : Sécurité des lieux de travail (Articles R4224-1 à R4224-24);Section 5 : Signalisation et matérialisation  relatives à la santé et à la sécurité (Articles R4224-20 à R4224-24);Article R4224-22;Création Décret n°2008-244 du 7 mars 2008 - art. (V);Un marquage est apposé à hauteur de vue sur les portes transparentes.;2008-244;2008-03-07;2008
Titre II : Obligations de l'employeur pour l'utilisation des lieux de travail  (Articles R4221-1 à R4228-37);Chapitre IV : Sécurité des lieux de travail (Articles R4224-1 à R4224-24);Section 5 : Signalisation et matérialisation  relatives à la santé et à la sécurité (Articles R4224-20 à R4224-24);Article R4224-23;Création Décret n°2008-244 du 7 mars 2008 - art. (V);Le matériel de premiers secours fait l'objet d'une signalisation par panneaux.;2008-244;2008-03-07;2008
Titre II : Obligations de l'employeur pour l'utilisation des lieux de travail  (Articles R4221-1 à R4228-37);Chapitre IV : Sécurité des lieux de travail (Articles R4224-1 à R4224-24);Section 5 : Signalisation et matérialisation  relatives à la santé et à la sécurité (Articles R4224-20 à R4224-24);Article R4224-24;Création Décret n°2008-244 du 7 mars 2008 - art. (V);"La signalisation relative à la santé et à la sécurité au travail est conforme à des caractéristiques déterminées par arrêté conjoint des ministres chargés du travail et de l'agriculture.
Ces dispositions n'affectent pas l'utilisation de la signalisation relative aux trafics routier, ferroviaire, fluvial, maritime et aérien, pour ce qui concerne ces trafics à l'intérieur de l'établissement.";2008-244;2008-03-07;2008
Titre II : Obligations de l'employeur pour l'utilisation des lieux de travail  (Articles R4221-1 à R4228-37);Chapitre V : Aménagement des postes de travail (Articles R4225-1 à R4225-8);Section 1 : Postes de travail extérieurs (Article R4225-1);Article R4225-1;Création Décret n°2008-244 du 7 mars 2008 - art. (V);"Les postes de travail extérieurs sont aménagés de telle sorte que les travailleurs :
1° Puissent rapidement quitter leur poste de travail en cas de danger ou puissent rapidement être secourus ;
2° Soient protégés contre la chute d'objets ;
3° Dans la mesure du possible :
a) Soient protégés contre les conditions atmosphériques ;
b) Ne soient pas exposés à des niveaux sonores nocifs ou à des émissions de gaz, vapeurs, aérosols de particules solides ou liquides de substances insalubres, gênantes ou dangereuses ;
c) Ne puissent glisser ou chuter.";2008-244;2008-03-07;2008
Titre II : Obligations de l'employeur pour l'utilisation des lieux de travail  (Articles R4221-1 à R4228-37);Chapitre V : Aménagement des postes de travail (Articles R4225-1 à R4225-8);Section 2 : Confort au poste de travail (Articles R4225-2 à R4225-5);Article R4225-2;Création Décret n°2008-244 du 7 mars 2008 - art. (V);L'employeur met à la disposition des travailleurs de l'eau potable et fraîche pour la boisson.;2008-244;2008-03-07;2008
Titre II : Obligations de l'employeur pour l'utilisation des lieux de travail  (Articles R4221-1 à R4228-37);Chapitre V : Aménagement des postes de travail (Articles R4225-1 à R4225-8);Section 2 : Confort au poste de travail (Articles R4225-2 à R4225-5);Article R4225-3;Modifié par Décret n°2017-1819 du 29 décembre 2017 - art. 3;"Lorsque des conditions particulières de travail conduisent les travailleurs à se désaltérer fréquemment, l'employeur met gratuitement à leur disposition au moins une boisson non alcoolisée.
La liste des postes de travail concernés est établie par l'employeur, après avis du médecin du travail et du                    comité social et économique.
Les boissons et les aromatisants mis à disposition sont choisis en tenant compte des souhaits exprimés par les travailleurs et après avis du médecin du travail.";2017-1819;2017-12-29;2017
Titre II : Obligations de l'employeur pour l'utilisation des lieux de travail  (Articles R4221-1 à R4228-37);Chapitre V : Aménagement des postes de travail (Articles R4225-1 à R4225-8);Section 2 : Confort au poste de travail (Articles R4225-2 à R4225-5);Article R4225-4;Création Décret n°2008-244 du 7 mars 2008 - art. (V);"L'employeur détermine l'emplacement des postes de distribution des boissons, à proximité des postes de travail et dans un endroit remplissant toutes les conditions d'hygiène.
L'employeur veille à l'entretien et au bon fonctionnement des appareils de distribution, à la bonne conservation des boissons et à éviter toute contamination.";2008-244;2008-03-07;2008
Titre II : Obligations de l'employeur pour l'utilisation des lieux de travail  (Articles R4221-1 à R4228-37);Chapitre V : Aménagement des postes de travail (Articles R4225-1 à R4225-8);Section 2 : Confort au poste de travail (Articles R4225-2 à R4225-5);Article R4225-5;Création Décret n°2008-244 du 7 mars 2008 - art. (V);Un siège approprié est mis à la disposition de chaque travailleur à son poste de travail ou à proximité de celui-ci.;2008-244;2008-03-07;2008
Titre II : Obligations de l'employeur pour l'utilisation des lieux de travail  (Articles R4221-1 à R4228-37);Chapitre V : Aménagement des postes de travail (Articles R4225-1 à R4225-8);Section 3 : Travailleurs handicapés (Articles R4225-6 à R4225-8);Article R4225-6;Création Décret n°2008-244 du 7 mars 2008 - art. (V);"Le poste de travail ainsi que les locaux sanitaires et de restauration que les travailleurs handicapés sont susceptibles d'utiliser dans l'établissement sont aménagés de telle sorte que ces travailleurs puissent y accéder aisément.
Leurs postes de travail ainsi que les signaux de sécurité qui les concernent sont aménagés si leur handicap l'exige.";2008-244;2008-03-07;2008
Titre II : Obligations de l'employeur pour l'utilisation des lieux de travail  (Articles R4221-1 à R4228-37);Chapitre V : Aménagement des postes de travail (Articles R4225-1 à R4225-8);Section 3 : Travailleurs handicapés (Articles R4225-6 à R4225-8);Article R4225-7;"Modifié par Décret n°2009-1272
 du 21 octobre 2009 - art. 2";Des installations sanitaires appropriées sont mises à la disposition des  travailleurs handicapés.;2009-1272;2009-10-21;2009
Titre II : Obligations de l'employeur pour l'utilisation des lieux de travail  (Articles R4221-1 à R4228-37);Chapitre V : Aménagement des postes de travail (Articles R4225-1 à R4225-8);Section 3 : Travailleurs handicapés (Articles R4225-6 à R4225-8);Article R4225-8;"Création Décret n°2009-1272
 du 21 octobre 2009 - art. 3";"Le système d'alarme sonore prévu à l'article
R. 4227-34
est complété par un ou des systèmes d'alarme adaptés au handicap des personnes concernées employées dans l'entreprise en vue de permettre leur information en tous lieux et en toutes circonstances.";2009-1272;2009-10-21;2009
