Titre;Chapitre;Section;Article;Décret;Contenu;Numéro Décret;Date decret;Annee decret
Titre Ier : Obligations du maître d'ouvrage pour la conception des lieux de travail  (Articles R4211-1 à R4217-2);Chapitre Ier : Principes généraux (Articles R4211-1 à R4211-5);Section 1 : Champ d'application et définitions (Articles R4211-1 à R4211-2);Article R4211-1;Création Décret n°2008-244 du 7 mars 2008 - art. (V);"Les dispositions du présent titre déterminent, en application de l'article
L. 4211-1
, les règles auxquelles se conforme le maître d'ouvrage entreprenant la construction ou l'aménagement de bâtiments destinés à recevoir des travailleurs, que ces opérations nécessitent ou non l'obtention d'un permis de construire.";2008-244;2008-03-07;2008
Titre Ier : Obligations du maître d'ouvrage pour la conception des lieux de travail  (Articles R4211-1 à R4217-2);Chapitre Ier : Principes généraux (Articles R4211-1 à R4211-5);Section 1 : Champ d'application et définitions (Articles R4211-1 à R4211-2);Article R4211-2;Création Décret n°2008-244 du 7 mars 2008 - art. (V);"Pour l'application du présent titre, on entend par lieux de travail les lieux destinés à recevoir des postes de travail, situés ou non dans les bâtiments de l'établissement, ainsi que tout autre endroit compris dans l'aire de l'établissement auquel le travailleur a accès dans le cadre de son travail.
Les champs, bois et autres terrains faisant partie d'un établissement agricole ou forestier mais situés en dehors de la zone bâtie d'un tel établissement ne sont pas considérés comme des lieux de travail.";2008-244;2008-03-07;2008
Titre Ier : Obligations du maître d'ouvrage pour la conception des lieux de travail  (Articles R4211-1 à R4217-2);Chapitre Ier : Principes généraux (Articles R4211-1 à R4211-5);Section 2 : Dossier de maintenance (Articles R4211-3 à R4211-5);Article R4211-3;"Modifié par Décret n°2011-1461
 du 7 novembre 2011 - art. 1";"Le maître d'ouvrage élabore et transmet aux utilisateurs, au moment de la prise de possession des locaux et au plus tard dans le mois qui suit, un dossier de maintenance des lieux de travail.
Ce dossier comporte notamment, outre les notices et dossiers techniques prévus aux articles
R. 4212-7
,
R. 4213-4
et
R. 4215-2
, les dispositions prises :
1° Pour le nettoyage des surfaces vitrées en élévation et en toiture en application de l'article
R. 4214-2
;
2° Pour l'accès en couverture, notamment :
a) Les moyens d'arrimage pour les interventions de courte durée ;
b) Les possibilités de mise en place rapide de garde-corps ou de filets de protection pour les interventions plus importantes ;
c) Les chemins de circulation permanents pour les interventions fréquentes ;
3° Pour faciliter l'entretien des façades, notamment les moyens d'arrimage et de stabilité d'échafaudage ou de nacelle ;
4° Pour faciliter les travaux d'entretien intérieur, notamment pour :
a) Le ravalement des halls de grande hauteur ;
b) Les accès aux machineries d'ascenseurs ;
c) Les accès aux canalisations en galerie technique, ou en vide sanitaire ;
5° Pour la localisation des espaces d'attente sécurisés au sens des articles
R. 4216-2-1
,
R. 4216-2-2
et
R. 4216-2-3
, il précise les caractéristiques de ces espaces.";2011-1461;2011-11-07;2011
Titre Ier : Obligations du maître d'ouvrage pour la conception des lieux de travail  (Articles R4211-1 à R4217-2);Chapitre Ier : Principes généraux (Articles R4211-1 à R4211-5);Section 2 : Dossier de maintenance (Articles R4211-3 à R4211-5);Article R4211-4;Création Décret n°2008-244 du 7 mars 2008 - art. (V);Le dossier de maintenance des lieux de travail indique, lorsqu'ils ont été aménagés à cet effet, les locaux techniques de nettoyage et les locaux sanitaires pouvant être mis à disposition des travailleurs chargés des travaux d'entretien.;2008-244;2008-03-07;2008
Titre Ier : Obligations du maître d'ouvrage pour la conception des lieux de travail  (Articles R4211-1 à R4217-2);Chapitre Ier : Principes généraux (Articles R4211-1 à R4211-5);Section 2 : Dossier de maintenance (Articles R4211-3 à R4211-5);Article R4211-5;Création Décret n°2008-244 du 7 mars 2008 - art. (V);Le dossier de maintenance des lieux de travail est tenu à la disposition de l'inspection du travail et des agents des services de prévention des organismes de sécurité sociale.;2008-244;2008-03-07;2008
Titre Ier : Obligations du maître d'ouvrage pour la conception des lieux de travail  (Articles R4211-1 à R4217-2);Chapitre III : Eclairage, insonorisation et ambiance thermique (Articles R4213-1 à R4213-9);Section 1 : Éclairage (Articles R4213-1 à R4213-4);Article R4213-1;Création Décret n°2008-244 du 7 mars 2008 - art. (V);"Le maître d'ouvrage conçoit et réalise les bâtiments et leurs aménagements de façon à ce qu'ils satisfassent aux règles d'éclairage prévues aux articles
R. 4223-2 à R. 4223-11
.";2008-244;2008-03-07;2008
Titre Ier : Obligations du maître d'ouvrage pour la conception des lieux de travail  (Articles R4211-1 à R4217-2);Chapitre III : Eclairage, insonorisation et ambiance thermique (Articles R4213-1 à R4213-9);Section 1 : Éclairage (Articles R4213-1 à R4213-4);Article R4213-2;Création Décret n°2008-244 du 7 mars 2008 - art. (V);Les bâtiments sont conçus et disposés de telle sorte que la lumière naturelle puisse être utilisée pour l'éclairage des locaux destinés à être affectés au travail, sauf dans les cas où la nature technique des activités s'y oppose.;2008-244;2008-03-07;2008
Titre Ier : Obligations du maître d'ouvrage pour la conception des lieux de travail  (Articles R4211-1 à R4217-2);Chapitre III : Eclairage, insonorisation et ambiance thermique (Articles R4213-1 à R4213-9);Section 1 : Éclairage (Articles R4213-1 à R4213-4);Article R4213-3;Création Décret n°2008-244 du 7 mars 2008 - art. (V);Les locaux destinés à être affectés au travail comportent à hauteur des yeux des baies transparentes donnant sur l'extérieur, sauf en cas d'incompatibilité avec la nature des activités envisagées.;2008-244;2008-03-07;2008
Titre Ier : Obligations du maître d'ouvrage pour la conception des lieux de travail  (Articles R4211-1 à R4217-2);Chapitre III : Eclairage, insonorisation et ambiance thermique (Articles R4213-1 à R4213-9);Section 1 : Éclairage (Articles R4213-1 à R4213-4);Article R4213-4;Création Décret n°2008-244 du 7 mars 2008 - art. (V);Le maître d'ouvrage consigne dans une notice d'instructions qu'il transmet à l'employeur les niveaux minimum d'éclairement, pendant les périodes de travail, des locaux, dégagements et emplacements, ainsi que les informations nécessaires à la détermination par l'employeur des règles d'entretien du matériel.;2008-244;2008-03-07;2008
Titre Ier : Obligations du maître d'ouvrage pour la conception des lieux de travail  (Articles R4211-1 à R4217-2);Chapitre III : Eclairage, insonorisation et ambiance thermique (Articles R4213-1 à R4213-9);Section 2 : Insonorisation (Articles R4213-5 à R4213-6);Article R4213-5;Création Décret n°2008-244 du 7 mars 2008 - art. (V);"Les locaux dans lesquels doivent être installés des équipements de travail susceptibles d'exposer les travailleurs à un niveau d'exposition sonore quotidienne supérieure à 85 dB(A) sont conçus, construits ou aménagés, compte tenu de l'état des techniques, de façon à :
1° Réduire la réverbération du bruit sur les parois de ces locaux lorsque cette réverbération occasionne une augmentation notable du niveau d'exposition des travailleurs ;
2° Limiter la propagation du bruit vers les autres locaux occupés par des travailleurs.";2008-244;2008-03-07;2008
Titre Ier : Obligations du maître d'ouvrage pour la conception des lieux de travail  (Articles R4211-1 à R4217-2);Chapitre III : Eclairage, insonorisation et ambiance thermique (Articles R4213-1 à R4213-9);Section 2 : Insonorisation (Articles R4213-5 à R4213-6);Article R4213-6;Création Décret n°2008-244 du 7 mars 2008 - art. (V);Un arrêté conjoint des ministres chargés du travail, de l'agriculture et de la construction détermine les prescriptions techniques nécessaires à l'application de la présente section.;2008-244;2008-03-07;2008
Titre Ier : Obligations du maître d'ouvrage pour la conception des lieux de travail  (Articles R4211-1 à R4217-2);Chapitre III : Eclairage, insonorisation et ambiance thermique (Articles R4213-1 à R4213-9);Section 3 : Ambiance thermique (Articles R4213-7 à R4213-9);Article R4213-7;Création Décret n°2008-244 du 7 mars 2008 - art. (V);Les équipements et caractéristiques des locaux de travail sont conçus de manière à permettre l'adaptation de la température à l'organisme humain pendant le temps de travail, compte tenu des méthodes de travail et des contraintes physiques supportées par les travailleurs.;2008-244;2008-03-07;2008
Titre Ier : Obligations du maître d'ouvrage pour la conception des lieux de travail  (Articles R4211-1 à R4217-2);Chapitre III : Eclairage, insonorisation et ambiance thermique (Articles R4213-1 à R4213-9);Section 3 : Ambiance thermique (Articles R4213-7 à R4213-9);Article R4213-8;Création Décret n°2008-244 du 7 mars 2008 - art. (V);Les équipements et caractéristiques des locaux annexes aux locaux de travail, notamment des locaux sanitaires, de restauration et médicaux, sont conçus de manière à permettre l'adaptation de la température à la destination spécifique de ces locaux.;2008-244;2008-03-07;2008
Titre Ier : Obligations du maître d'ouvrage pour la conception des lieux de travail  (Articles R4211-1 à R4217-2);Chapitre III : Eclairage, insonorisation et ambiance thermique (Articles R4213-1 à R4213-9);Section 3 : Ambiance thermique (Articles R4213-7 à R4213-9);Article R4213-9;Modifié par Décret n°2021-872 du 30 juin 2021 - art. 7;"Les dispositions de la présente section ne font pas obstacle à celles des
articles L. 171-1
et
L. 173-1 du code de la construction et de l'habitation
relatives aux caractéristiques thermiques des bâtiments autres que d'habitation.";2021-872;2021-06-30;2021
Titre Ier : Obligations du maître d'ouvrage pour la conception des lieux de travail  (Articles R4211-1 à R4217-2);Chapitre IV : Sécurité des lieux de travail (Articles R4214-1 à R4214-28);Section 1 : Caractéristiques des bâtiments (Articles R4214-1 à R4214-8);Article R4214-1;Création Décret n°2008-244 du 7 mars 2008 - art. (V);"Les bâtiments destinés à abriter des lieux de travail sont conçus et réalisés de manière à pouvoir résister, dans leur ensemble et dans chacun de leurs éléments, à l'effet combiné de leur poids, des charges climatiques extrêmes et des surcharges maximales correspondant à leur type d'utilisation.
Ils respectent les règles antisismiques prévues, le cas échéant, par les dispositions en vigueur.";2008-244;2008-03-07;2008
Titre Ier : Obligations du maître d'ouvrage pour la conception des lieux de travail  (Articles R4211-1 à R4217-2);Chapitre IV : Sécurité des lieux de travail (Articles R4214-1 à R4214-28);Section 1 : Caractéristiques des bâtiments (Articles R4214-1 à R4214-8);Article R4214-2;Création Décret n°2008-244 du 7 mars 2008 - art. (V);Les bâtiments et leurs équipements sont conçus et réalisés de telle sorte que les surfaces vitrées en élévation ou en toiture puissent être nettoyées sans danger pour les travailleurs accomplissant ce travail et pour ceux présents dans le bâtiment et autour de celui-ci. Chaque fois que possible, des solutions de protection collective sont choisies.;2008-244;2008-03-07;2008
Titre Ier : Obligations du maître d'ouvrage pour la conception des lieux de travail  (Articles R4211-1 à R4217-2);Chapitre IV : Sécurité des lieux de travail (Articles R4214-1 à R4214-28);Section 1 : Caractéristiques des bâtiments (Articles R4214-1 à R4214-8);Article R4214-3;Création Décret n°2008-244 du 7 mars 2008 - art. (V);"Les planchers des locaux sont exempts de bosses, de trous ou de plans inclinés dangereux.
Ils sont fixes, stables et non glissants.";2008-244;2008-03-07;2008
Titre Ier : Obligations du maître d'ouvrage pour la conception des lieux de travail  (Articles R4211-1 à R4217-2);Chapitre IV : Sécurité des lieux de travail (Articles R4214-1 à R4214-28);Section 1 : Caractéristiques des bâtiments (Articles R4214-1 à R4214-8);Article R4214-4;Création Décret n°2008-244 du 7 mars 2008 - art. (V);Les surfaces des planchers, des murs et des plafonds sont conçues de manière à pouvoir être nettoyées ou ravalées en vue d'obtenir des conditions d'hygiène appropriées.;2008-244;2008-03-07;2008
Titre Ier : Obligations du maître d'ouvrage pour la conception des lieux de travail  (Articles R4211-1 à R4217-2);Chapitre IV : Sécurité des lieux de travail (Articles R4214-1 à R4214-28);Section 1 : Caractéristiques des bâtiments (Articles R4214-1 à R4214-8);Article R4214-5;Création Décret n°2008-244 du 7 mars 2008 - art. (V);Les ouvrants en élévation ou en toiture sont conçus de manière à ne pas constituer, en position d'ouverture, un danger pour les travailleurs.;2008-244;2008-03-07;2008
Titre Ier : Obligations du maître d'ouvrage pour la conception des lieux de travail  (Articles R4211-1 à R4217-2);Chapitre IV : Sécurité des lieux de travail (Articles R4214-1 à R4214-28);Section 1 : Caractéristiques des bâtiments (Articles R4214-1 à R4214-8);Article R4214-6;Création Décret n°2008-244 du 7 mars 2008 - art. (V);"Les parois transparentes ou translucides sont signalées par un marquage à hauteur de vue.
Elles sont constituées de matériaux de sécurité ou sont disposées de telle sorte que les travailleurs ne puissent pas être blessés si ces parois volent en éclats.";2008-244;2008-03-07;2008
Titre Ier : Obligations du maître d'ouvrage pour la conception des lieux de travail  (Articles R4211-1 à R4217-2);Chapitre IV : Sécurité des lieux de travail (Articles R4214-1 à R4214-28);Section 1 : Caractéristiques des bâtiments (Articles R4214-1 à R4214-8);Article R4214-7;Création Décret n°2008-244 du 7 mars 2008 - art. (V);"Les portes et portails obéissent aux caractéristiques définies aux articles
R. 4224-9
et suivants.
Leurs dimensions et leurs caractéristiques sont déterminées en fonction de la nature et de l'usage des pièces ou enceintes qu'ils desservent, en tenant compte des dispositions du chapitre VI relatives à la prévention des incendies et à l'évacuation.";2008-244;2008-03-07;2008
Titre Ier : Obligations du maître d'ouvrage pour la conception des lieux de travail  (Articles R4211-1 à R4217-2);Chapitre IV : Sécurité des lieux de travail (Articles R4214-1 à R4214-28);Section 1 : Caractéristiques des bâtiments (Articles R4214-1 à R4214-8);Article R4214-8;Création Décret n°2008-244 du 7 mars 2008 - art. (V);"Les portes et portails automatiques comportent un système de sécurité interrompant immédiatement tout mouvement d'ouverture ou de fermeture lorsque ce mouvement peut causer un dommage à une personne.
Ils sont conçus de manière à pouvoir être ouverts manuellement, sauf s'ils s'ouvrent automatiquement en cas de panne d'énergie.
Un arrêté conjoint des ministres chargés du travail, de l'agriculture et de la construction précise, en tant que de besoin, les règles de sécurité auxquelles ces portes et portails obéissent.";2008-244;2008-03-07;2008
Titre Ier : Obligations du maître d'ouvrage pour la conception des lieux de travail  (Articles R4211-1 à R4217-2);Chapitre IV : Sécurité des lieux de travail (Articles R4214-1 à R4214-28);Section 2 : Voies de circulation et accès (Articles R4214-9 à R4214-17);Article R4214-9;Création Décret n°2008-244 du 7 mars 2008 - art. (V);"L'implantation et les dimensions des voies de circulation, y compris les escaliers et les échelles fixes sont déterminées en tenant compte des dispositions du chapitre VI relatives à la prévention des incendies et l'évacuation.
Les voies de circulation sont conçues de telle sorte que :
1° Les piétons ou les véhicules puissent les utiliser facilement, en toute sécurité, conformément à leur affectation ;
2° Les travailleurs employés à proximité des voies de circulation n'encourent aucun danger.";2008-244;2008-03-07;2008
Titre Ier : Obligations du maître d'ouvrage pour la conception des lieux de travail  (Articles R4211-1 à R4217-2);Chapitre IV : Sécurité des lieux de travail (Articles R4214-1 à R4214-28);Section 2 : Voies de circulation et accès (Articles R4214-9 à R4214-17);Article R4214-10;Création Décret n°2008-244 du 7 mars 2008 - art. (V);Les portes et les dégagements destinés aux piétons sont situés, par rapport aux voies de circulation destinées aux véhicules, à une distance telle qu'elle garantisse aux piétons une circulation sans danger.;2008-244;2008-03-07;2008
Titre Ier : Obligations du maître d'ouvrage pour la conception des lieux de travail  (Articles R4211-1 à R4217-2);Chapitre IV : Sécurité des lieux de travail (Articles R4214-1 à R4214-28);Section 2 : Voies de circulation et accès (Articles R4214-9 à R4214-17);Article R4214-11;Création Décret n°2008-244 du 7 mars 2008 - art. (V);"Dès que l'importance de la circulation des véhicules ou le danger lié à l'utilisation et à l'équipement des locaux le justifie, le marquage au sol des voies de circulation est mis en évidence.
Ce marquage obéit à la réglementation en vigueur relative à la signalisation dans les lieux de travail.";2008-244;2008-03-07;2008
Titre Ier : Obligations du maître d'ouvrage pour la conception des lieux de travail  (Articles R4211-1 à R4217-2);Chapitre IV : Sécurité des lieux de travail (Articles R4214-1 à R4214-28);Section 2 : Voies de circulation et accès (Articles R4214-9 à R4214-17);Article R4214-12;Création Décret n°2008-244 du 7 mars 2008 - art. (V);A proximité des portails destinés essentiellement à la circulation des véhicules, des portes pour les piétons sont aménagées, signalées de manière bien visible et dégagées en permanence.;2008-244;2008-03-07;2008
Titre Ier : Obligations du maître d'ouvrage pour la conception des lieux de travail  (Articles R4211-1 à R4217-2);Chapitre IV : Sécurité des lieux de travail (Articles R4214-1 à R4214-28);Section 2 : Voies de circulation et accès (Articles R4214-9 à R4214-17);Article R4214-13;Création Décret n°2008-244 du 7 mars 2008 - art. (V);"Les articles
R. 4214-9 à R. 4214-12
s'appliquent également aux voies de circulation principales sur le terrain de l'entreprise, ainsi qu'aux voies de circulation utilisées pour la surveillance et l'entretien régulier des installations de l'entreprise.";2008-244;2008-03-07;2008
Titre Ier : Obligations du maître d'ouvrage pour la conception des lieux de travail  (Articles R4211-1 à R4217-2);Chapitre IV : Sécurité des lieux de travail (Articles R4214-1 à R4214-28);Section 2 : Voies de circulation et accès (Articles R4214-9 à R4214-17);Article R4214-14;Création Décret n°2008-244 du 7 mars 2008 - art. (V);Lorsque la nature des activités envisagées est susceptible d'entraîner sur les lieux de travail des zones de danger qui n'ont pu être évitées, ces zones sont signalées de manière visible et matérialisées par des dispositifs destinés à éviter que les travailleurs non autorisés y pénètrent.;2008-244;2008-03-07;2008
Titre Ier : Obligations du maître d'ouvrage pour la conception des lieux de travail  (Articles R4211-1 à R4217-2);Chapitre IV : Sécurité des lieux de travail (Articles R4214-1 à R4214-28);Section 2 : Voies de circulation et accès (Articles R4214-9 à R4214-17);Article R4214-15;"Modifié par Décret n°2008-1325
 du 15 décembre 2008 - art. 1";Lors de l'installation dans un bâtiment destiné à accueillir des travailleurs d'escaliers mécaniques et de trottoirs roulants, d'ascenseurs, de monte-charges, d'installations de parcage de véhicules et d'élévateurs de personnes dont la vitesse n'excède pas 0, 15 mètre par seconde, le maître d'ouvrage s'assure que ces équipements sont conçus et mis en place conformément aux règles en vigueur lors de cette installation.;2008-1325;2008-12-15;2008
Titre Ier : Obligations du maître d'ouvrage pour la conception des lieux de travail  (Articles R4211-1 à R4217-2);Chapitre IV : Sécurité des lieux de travail (Articles R4214-1 à R4214-28);Section 2 : Voies de circulation et accès (Articles R4214-9 à R4214-17);Article R4214-16;"Modifié par Décret n°2008-1325
 du 15 décembre 2008 - art. 1";"Lors de leur installation, le maître d'ouvrage s'assure que les escaliers mécaniques et les trottoirs roulants, les ascenseurs, les monte-charges, les installations de parcage de véhicules et les élévateurs de personnes dont la vitesse n'excède pas 0, 15 mètre par seconde sont installés de manière à permettre les interventions et travaux énumérés à
l'article R. 4543-1
dans des conditions sûres, ergonomiques et préservant la santé des intervenants.";2008-1325;2008-12-15;2008
Titre Ier : Obligations du maître d'ouvrage pour la conception des lieux de travail  (Articles R4211-1 à R4217-2);Chapitre IV : Sécurité des lieux de travail (Articles R4214-1 à R4214-28);Section 2 : Voies de circulation et accès (Articles R4214-9 à R4214-17);Article R4214-17;Création Décret n°2008-244 du 7 mars 2008 - art. (V);Les postes de travail, voies de circulation et autres emplacements ou installations à l'air libre destinés à être occupés ou utilisés par des travailleurs lors de leurs activités sont conçus de telle sorte que la circulation des piétons et des véhicules puisse se faire de manière sûre.;2008-244;2008-03-07;2008
Titre Ier : Obligations du maître d'ouvrage pour la conception des lieux de travail  (Articles R4211-1 à R4217-2);Chapitre IV : Sécurité des lieux de travail (Articles R4214-1 à R4214-28);Section 3 : Quais et rampes de chargement (Articles R4214-18 à R4214-21);Article R4214-18;Création Décret n°2008-244 du 7 mars 2008 - art. (V);"Les dispositions des articles
R. 4214-9 à R. 4214-12
s'appliquent également aux quais de chargement extérieurs de l'entreprise.";2008-244;2008-03-07;2008
Titre Ier : Obligations du maître d'ouvrage pour la conception des lieux de travail  (Articles R4211-1 à R4217-2);Chapitre IV : Sécurité des lieux de travail (Articles R4214-1 à R4214-28);Section 3 : Quais et rampes de chargement (Articles R4214-18 à R4214-21);Article R4214-19;Création Décret n°2008-244 du 7 mars 2008 - art. (V);Les dimensions des charges susceptibles d'être transportées sont prises en compte pour la conception et la disposition des quais et rampes de chargement.;2008-244;2008-03-07;2008
Titre Ier : Obligations du maître d'ouvrage pour la conception des lieux de travail  (Articles R4211-1 à R4217-2);Chapitre IV : Sécurité des lieux de travail (Articles R4214-1 à R4214-28);Section 3 : Quais et rampes de chargement (Articles R4214-18 à R4214-21);Article R4214-20;Création Décret n°2008-244 du 7 mars 2008 - art. (V);"Les quais de chargement comportent au moins une issue.
Lorsque leur longueur est supérieure à 20 mètres, ils ont une issue à chaque extrémité.";2008-244;2008-03-07;2008
Titre Ier : Obligations du maître d'ouvrage pour la conception des lieux de travail  (Articles R4211-1 à R4217-2);Chapitre IV : Sécurité des lieux de travail (Articles R4214-1 à R4214-28);Section 3 : Quais et rampes de chargement (Articles R4214-18 à R4214-21);Article R4214-21;Création Décret n°2008-244 du 7 mars 2008 - art. (V);Les rampes et quais de chargement sont disposés et aménagés de manière à éviter aux travailleurs les risques de chute.;2008-244;2008-03-07;2008
Titre Ier : Obligations du maître d'ouvrage pour la conception des lieux de travail  (Articles R4211-1 à R4217-2);Chapitre IV : Sécurité des lieux de travail (Articles R4214-1 à R4214-28);Section 4 : Aménagement des lieux et postes de travail (Articles R4214-22 à R4214-25);Article R4214-22;Création Décret n°2008-244 du 7 mars 2008 - art. (V);"Les dimensions des locaux de travail, notamment leur hauteur et leur surface, sont telles qu'elles permettent aux travailleurs d'exécuter leur tâche sans risque pour leur santé, leur sécurité ou leur bien-être.
L'espace libre au poste de travail, compte tenu du mobilier, est prévu pour que les travailleurs disposent d'une liberté de mouvement suffisante.
Lorsque, pour des raisons propres au poste de travail, ces dispositions ne peuvent être respectées, il est prévu un espace libre suffisant à proximité de ce poste.";2008-244;2008-03-07;2008
Titre Ier : Obligations du maître d'ouvrage pour la conception des lieux de travail  (Articles R4211-1 à R4217-2);Chapitre IV : Sécurité des lieux de travail (Articles R4214-1 à R4214-28);Section 4 : Aménagement des lieux et postes de travail (Articles R4214-22 à R4214-25);Article R4214-23;Création Décret n°2008-244 du 7 mars 2008 - art. (V);"Lorsque l'effectif prévu est au moins égal à deux cents dans les établissements industriels ou à cinq cents dans les autres établissements, un local destiné aux premiers secours, facilement accessible avec des brancards et pouvant contenir les installations et le matériel de premiers secours, est aménagé.
Les locaux médicaux dont les caractéristiques sont déterminées par l'arrêté mentionné à l'article
R. 4624-30
peuvent être utilisés comme locaux de premiers secours sous réserve de remplir les conditions prévues au premier alinéa.
Le local de premiers secours comporte une signalisation.";2008-244;2008-03-07;2008
