Titre;Chapitre;Section;Article;Décret;Contenu;Numéro Décret;Date decret;Annee decret
Titre II : Obligations de l'employeur pour l'utilisation des lieux de travail  (Articles R4221-1 à R4228-37);Chapitre VII : Risques d'incendies et d'explosions et évacuation (Articles R4227-1 à R4227-57);Section 2 : Dégagements (Articles R4227-4 à R4227-14);Article R4227-13;"Modifié par Décret n°2011-1461
 du 7 novembre 2011 - art. 5";"Une signalisation indique le chemin vers la sortie  la plus proche ainsi que le chemin vers l'espace d'attente sécurisé ou l'espace équivalent le plus proche. Une autre signalisation identifie ces espaces.
Les dégagements qui ne servent pas habituellement de passage pendant la période de travail sont signalés par la mention sortie de secours.";2011-1461;2011-11-07;2011
Titre II : Obligations de l'employeur pour l'utilisation des lieux de travail  (Articles R4221-1 à R4228-37);Chapitre VII : Risques d'incendies et d'explosions et évacuation (Articles R4227-1 à R4227-57);Section 2 : Dégagements (Articles R4227-4 à R4227-14);Article R4227-14;"Modifié par Décret n°2010-1018
 du 30 août 2010 - art. 1";"Les établissements disposent d'un éclairage de sécurité permettant d'assurer l'évacuation des personnes en cas d'interruption accidentelle de l'éclairage normal.
La conception, la mise en œuvre et les conditions d'exploitation et de maintenance de cet éclairage ainsi que les locaux qui peuvent en être dispensés en raison de leur faible superficie ou de leur faible fréquentation sont définis par un arrêté des ministres chargés du travail et de l'agriculture.";2010-1018;2010-08-30;2010
Titre II : Obligations de l'employeur pour l'utilisation des lieux de travail  (Articles R4221-1 à R4228-37);Chapitre VII : Risques d'incendies et d'explosions et évacuation (Articles R4227-1 à R4227-57);Section 3 : Chauffage des locaux (Articles R4227-15 à R4227-20);Article R4227-15;Création Décret n°2008-244 du 7 mars 2008 - art. (V);"Les dispositions de la présente section s'appliquent sans préjudice de l'application des réglementations relatives :
1° Aux installations fixes destinées au chauffage et à l'alimentation en eau chaude ;
2° Aux installations de gaz combustibles et d'hydrocarbures liquéfiés ;
3° Au stockage et à l'utilisation des produits pétroliers.";2008-244;2008-03-07;2008
Titre II : Obligations de l'employeur pour l'utilisation des lieux de travail  (Articles R4221-1 à R4228-37);Chapitre VII : Risques d'incendies et d'explosions et évacuation (Articles R4227-1 à R4227-57);Section 3 : Chauffage des locaux (Articles R4227-15 à R4227-20);Article R4227-16;Création Décret n°2008-244 du 7 mars 2008 - art. (V);Il est interdit d'employer pour le chauffage des combustibles liquides dont le point éclair est inférieur à 55 °C.;2008-244;2008-03-07;2008
Titre II : Obligations de l'employeur pour l'utilisation des lieux de travail  (Articles R4221-1 à R4228-37);Chapitre VII : Risques d'incendies et d'explosions et évacuation (Articles R4227-1 à R4227-57);Section 3 : Chauffage des locaux (Articles R4227-15 à R4227-20);Article R4227-17;Création Décret n°2008-244 du 7 mars 2008 - art. (V);Il est interdit de remplir les réservoirs des appareils de chauffage au cours du fonctionnement de l'appareil ou dans une pièce comportant des flammes, des éléments incandescents ou des surfaces portées à plus de 100 °C.;2008-244;2008-03-07;2008
Titre II : Obligations de l'employeur pour l'utilisation des lieux de travail  (Articles R4221-1 à R4228-37);Chapitre VII : Risques d'incendies et d'explosions et évacuation (Articles R4227-1 à R4227-57);Section 3 : Chauffage des locaux (Articles R4227-15 à R4227-20);Article R4227-18;Création Décret n°2008-244 du 7 mars 2008 - art. (V);Les appareils de production-émission de chaleur, ainsi que leurs tuyaux et cheminées, sont installés de façon à ne pouvoir communiquer le feu aux matériaux de construction, aux matières et objets susceptibles d'être placés à proximité et aux vêtements des travailleurs.;2008-244;2008-03-07;2008
Titre II : Obligations de l'employeur pour l'utilisation des lieux de travail  (Articles R4221-1 à R4228-37);Chapitre VII : Risques d'incendies et d'explosions et évacuation (Articles R4227-1 à R4227-57);Section 3 : Chauffage des locaux (Articles R4227-15 à R4227-20);Article R4227-19;Création Décret n°2008-244 du 7 mars 2008 - art. (V);"Les canalisations amenant les liquides ou gaz combustibles aux appareils fixes de production-émission de chaleur sont entièrement métalliques et assemblées par soudure.
L'emploi des conduites en plomb est interdit.";2008-244;2008-03-07;2008
Titre II : Obligations de l'employeur pour l'utilisation des lieux de travail  (Articles R4221-1 à R4228-37);Chapitre VII : Risques d'incendies et d'explosions et évacuation (Articles R4227-1 à R4227-57);Section 3 : Chauffage des locaux (Articles R4227-15 à R4227-20);Article R4227-20;Création Décret n°2008-244 du 7 mars 2008 - art. (V);"Les circuits alimentant les installations comportent un dispositif d'arrêt d'urgence de l'alimentation en énergie de l'ensemble des appareils.
Le dispositif d'arrêt est manœuvrable à partir d'un endroit accessible en permanence et signalé.";2008-244;2008-03-07;2008
Titre II : Obligations de l'employeur pour l'utilisation des lieux de travail  (Articles R4221-1 à R4228-37);Chapitre VII : Risques d'incendies et d'explosions et évacuation (Articles R4227-1 à R4227-57);Section 4 : Emploi et stockage  de matières explosives et inflammables (Articles R4227-22 à R4227-27);Article non disponible;"Abrogé par Décret n°2010-1018
 du 30 août 2010 - art. 1";"Les installations électriques pour les locaux ou les emplacements présentant des dangers d'incendie ou des risques d'explosion sont précisées par le
décret n° 88-1056 du 14 novembre 1988
relatif à la protection des travailleurs dans les établissements qui mettent en œuvre des courants électriques.";2010-1018;2010-08-30;2010
Titre II : Obligations de l'employeur pour l'utilisation des lieux de travail  (Articles R4221-1 à R4228-37);Chapitre VII : Risques d'incendies et d'explosions et évacuation (Articles R4227-1 à R4227-57);Section 4 : Emploi et stockage  de matières explosives et inflammables (Articles R4227-22 à R4227-27);Article R4227-22;Création Décret n°2008-244 du 7 mars 2008 - art. (V);"Les locaux ou les emplacements dans lesquels sont entreposées ou manipulées des substances ou préparations classées explosives, comburantes ou extrêmement inflammables, ainsi que des matières dans un état physique susceptible d'engendrer des risques d'explosion ou d'inflammation instantanée, ne contiennent aucune source d'ignition telle que foyer, flamme, appareil pouvant donner lieu à production extérieure d'étincelles ni aucune surface susceptible de provoquer par sa température une auto-inflammation des substances, préparations ou matières précitées.
Ces locaux disposent d'une ventilation permanente appropriée.";2008-244;2008-03-07;2008
Titre II : Obligations de l'employeur pour l'utilisation des lieux de travail  (Articles R4221-1 à R4228-37);Chapitre VII : Risques d'incendies et d'explosions et évacuation (Articles R4227-1 à R4227-57);Section 4 : Emploi et stockage  de matières explosives et inflammables (Articles R4227-22 à R4227-27);Article R4227-23;Création Décret n°2008-244 du 7 mars 2008 - art. (V);"Outre l'interdiction de fumer dans les lieux collectifs, prévue à l'article
L. 3511-7
du code de la santé publique, il est interdit de fumer dans les emplacements situés à l'air libre mentionnés à l'article
R. 4227-22
.
Cette interdiction fait l'objet d'une signalisation conforme à la réglementation en vigueur.";2008-244;2008-03-07;2008
Titre II : Obligations de l'employeur pour l'utilisation des lieux de travail  (Articles R4221-1 à R4228-37);Chapitre VII : Risques d'incendies et d'explosions et évacuation (Articles R4227-1 à R4227-57);Section 4 : Emploi et stockage  de matières explosives et inflammables (Articles R4227-22 à R4227-27);Article R4227-24;Création Décret n°2008-244 du 7 mars 2008 - art. (V);"Les locaux mentionnés à l'article
R. 4227-22
ainsi que ceux dans lesquels sont entreposées ou manipulées des substances ou préparations classées facilement inflammables ou des matières dans un état physique tel qu'elles sont susceptibles de prendre feu instantanément au contact d'une flamme ou d'une étincelle et de propager rapidement l'incendie, sont utilisés de telle sorte que :
1° Aucun poste habituel de travail ne se trouve à plus de 10 mètres d'une issue donnant sur l'extérieur ou sur un local donnant lui-même sur l'extérieur ;
2° Les portes de ces locaux s'ouvrent vers l'extérieur ;
3° Si les fenêtres de ces locaux sont munies de grilles ou grillages, ceux-ci s'ouvrent très facilement de l'intérieur.";2008-244;2008-03-07;2008
Titre II : Obligations de l'employeur pour l'utilisation des lieux de travail  (Articles R4221-1 à R4228-37);Chapitre VII : Risques d'incendies et d'explosions et évacuation (Articles R4227-1 à R4227-57);Section 4 : Emploi et stockage  de matières explosives et inflammables (Articles R4227-22 à R4227-27);Article R4227-25;Création Décret n°2008-244 du 7 mars 2008 - art. (V);"Il est interdit de déposer et de laisser séjourner les substances, préparations ou matières mentionnées aux articles
R. 4227-22
et
R. 4227-24
dans les escaliers, passages et couloirs, sous les escaliers ainsi qu'à proximité des issues des locaux et bâtiments.";2008-244;2008-03-07;2008
Titre II : Obligations de l'employeur pour l'utilisation des lieux de travail  (Articles R4221-1 à R4228-37);Chapitre VII : Risques d'incendies et d'explosions et évacuation (Articles R4227-1 à R4227-57);Section 4 : Emploi et stockage  de matières explosives et inflammables (Articles R4227-22 à R4227-27);Article R4227-26;Création Décret n°2008-244 du 7 mars 2008 - art. (V);Les chiffons, cotons et papiers imprégnés de liquides inflammables ou de matières grasses sont, après usage, enfermés dans des récipients métalliques clos et étanches.;2008-244;2008-03-07;2008
Titre II : Obligations de l'employeur pour l'utilisation des lieux de travail  (Articles R4221-1 à R4228-37);Chapitre VII : Risques d'incendies et d'explosions et évacuation (Articles R4227-1 à R4227-57);Section 4 : Emploi et stockage  de matières explosives et inflammables (Articles R4227-22 à R4227-27);Article R4227-27;Création Décret n°2008-244 du 7 mars 2008 - art. (V);Un arrêté des ministres chargés du travail et de l'agriculture détermine les dispositions spécifiques relatives aux installations industrielles utilisant le gaz combustible et les hydrocarbures liquéfiés.;2008-244;2008-03-07;2008
Titre II : Obligations de l'employeur pour l'utilisation des lieux de travail  (Articles R4221-1 à R4228-37);Chapitre VII : Risques d'incendies et d'explosions et évacuation (Articles R4227-1 à R4227-57);Section 5 : Moyens de prévention  et de lutte contre l'incendie (Articles R4227-28 à R4227-41);Article R4227-28;Création Décret n°2008-244 du 7 mars 2008 - art. (V);L'employeur prend les mesures nécessaires pour que tout commencement d'incendie puisse être rapidement et efficacement combattu dans l'intérêt du sauvetage des travailleurs.;2008-244;2008-03-07;2008
Titre II : Obligations de l'employeur pour l'utilisation des lieux de travail  (Articles R4221-1 à R4228-37);Chapitre VII : Risques d'incendies et d'explosions et évacuation (Articles R4227-1 à R4227-57);Section 5 : Moyens de prévention  et de lutte contre l'incendie (Articles R4227-28 à R4227-41);Article R4227-29;Création Décret n°2008-244 du 7 mars 2008 - art. (V);"Le premier secours contre l'incendie est assuré par des extincteurs en nombre suffisant et maintenus en bon état de fonctionnement.
Il existe au moins un extincteur portatif à eau pulvérisée d'une capacité minimale de 6 litres pour 200 mètres carrés de plancher.
Il existe au moins un appareil par niveau.
Lorsque les locaux présentent des risques d'incendie particuliers, notamment des risques électriques, ils sont dotés d'extincteurs dont le nombre et le type sont appropriés aux risques.";2008-244;2008-03-07;2008
Titre II : Obligations de l'employeur pour l'utilisation des lieux de travail  (Articles R4221-1 à R4228-37);Chapitre VII : Risques d'incendies et d'explosions et évacuation (Articles R4227-1 à R4227-57);Section 5 : Moyens de prévention  et de lutte contre l'incendie (Articles R4227-28 à R4227-41);Article R4227-30;Création Décret n°2008-244 du 7 mars 2008 - art. (V);Si nécessaire, l'établissement est équipé de robinets d'incendie armés, de colonnes sèches, de colonnes humides, d'installations fixes d'extinction automatique d'incendie ou d'installations de détection automatique d'incendie.;2008-244;2008-03-07;2008
Titre II : Obligations de l'employeur pour l'utilisation des lieux de travail  (Articles R4221-1 à R4228-37);Chapitre VII : Risques d'incendies et d'explosions et évacuation (Articles R4227-1 à R4227-57);Section 5 : Moyens de prévention  et de lutte contre l'incendie (Articles R4227-28 à R4227-41);Article R4227-31;Création Décret n°2008-244 du 7 mars 2008 - art. (V);Les dispositifs d'extinction non automatiques sont d'accès et de manipulation faciles.;2008-244;2008-03-07;2008
Titre II : Obligations de l'employeur pour l'utilisation des lieux de travail  (Articles R4221-1 à R4228-37);Chapitre VII : Risques d'incendies et d'explosions et évacuation (Articles R4227-1 à R4227-57);Section 5 : Moyens de prévention  et de lutte contre l'incendie (Articles R4227-28 à R4227-41);Article R4227-32;Création Décret n°2008-244 du 7 mars 2008 - art. (V);Quand la nécessité l'impose, une quantité de sable ou de terre meuble proportionnée à l'importance de l'établissement, à la disposition des locaux et à la nature des travaux exécutés est conservée à proximité des emplacements de travail, avec un moyen de projection, pour servir à éteindre un commencement d'incendie.;2008-244;2008-03-07;2008
Titre II : Obligations de l'employeur pour l'utilisation des lieux de travail  (Articles R4221-1 à R4228-37);Chapitre VII : Risques d'incendies et d'explosions et évacuation (Articles R4227-1 à R4227-57);Section 5 : Moyens de prévention  et de lutte contre l'incendie (Articles R4227-28 à R4227-41);Article R4227-33;Création Décret n°2008-244 du 7 mars 2008 - art. (V);Les installations d'extinction font l'objet d'une signalisation durable aux endroits appropriés.;2008-244;2008-03-07;2008
Titre II : Obligations de l'employeur pour l'utilisation des lieux de travail  (Articles R4221-1 à R4228-37);Chapitre VII : Risques d'incendies et d'explosions et évacuation (Articles R4227-1 à R4227-57);Section 5 : Moyens de prévention  et de lutte contre l'incendie (Articles R4227-28 à R4227-41);Article R4227-34;Création Décret n°2008-244 du 7 mars 2008 - art. (V);"Les établissements dans lesquels peuvent se trouver occupées ou réunies habituellement plus de cinquante personnes, ainsi que ceux, quelle que soit leur importance, où sont manipulées et mises en œuvre des matières inflammables mentionnées à l'article
R. 4227-22
sont équipés d'un système d'alarme sonore.";2008-244;2008-03-07;2008
Titre II : Obligations de l'employeur pour l'utilisation des lieux de travail  (Articles R4221-1 à R4228-37);Chapitre VII : Risques d'incendies et d'explosions et évacuation (Articles R4227-1 à R4227-57);Section 5 : Moyens de prévention  et de lutte contre l'incendie (Articles R4227-28 à R4227-41);Article R4227-35;Création Décret n°2008-244 du 7 mars 2008 - art. (V);L'alarme sonore générale est donnée par bâtiment si l'établissement comporte plusieurs bâtiments isolés entre eux.;2008-244;2008-03-07;2008
Titre II : Obligations de l'employeur pour l'utilisation des lieux de travail  (Articles R4221-1 à R4228-37);Chapitre VII : Risques d'incendies et d'explosions et évacuation (Articles R4227-1 à R4227-57);Section 5 : Moyens de prévention  et de lutte contre l'incendie (Articles R4227-28 à R4227-41);Article R4227-36;Création Décret n°2008-244 du 7 mars 2008 - art. (V);Le signal sonore d'alarme générale est tel qu'il ne permet pas la confusion avec d'autres signalisations utilisées dans l'établissement. Il est audible de tout point du bâtiment pendant le temps nécessaire à l'évacuation, avec une autonomie minimale de cinq minutes.;2008-244;2008-03-07;2008
Titre II : Obligations de l'employeur pour l'utilisation des lieux de travail  (Articles R4221-1 à R4228-37);Chapitre VII : Risques d'incendies et d'explosions et évacuation (Articles R4227-1 à R4227-57);Section 5 : Moyens de prévention  et de lutte contre l'incendie (Articles R4227-28 à R4227-41);Article R4227-37;"Modifié par Décret n°2011-1461
 du 7 novembre 2011 - art. 6";"Dans les établissements mentionnés à l'article
R. 4227-34
, une consigne de sécurité incendie est établie et affichée de manière très apparente :
1° Dans chaque local pour les locaux dont l'effectif est supérieur à cinq personnes et pour les locaux mentionnés à l'article
R. 4227-24
;
2° Dans chaque local ou dans chaque dégagement desservant un groupe de locaux dans les autres cas.
Dans les autres établissements, des instructions sont établies, permettant d'assurer l'évacuation des personnes présentes dans les locaux dans les conditions prévues au 1° de l'article
R. 4216-2
.";2011-1461;2011-11-07;2011
Titre II : Obligations de l'employeur pour l'utilisation des lieux de travail  (Articles R4221-1 à R4228-37);Chapitre VII : Risques d'incendies et d'explosions et évacuation (Articles R4227-1 à R4227-57);Section 5 : Moyens de prévention  et de lutte contre l'incendie (Articles R4227-28 à R4227-41);Article R4227-38;"Modifié par Décret n°2011-1461
 du 7 novembre 2011 - art. 7";"La consigne de sécurité incendie indique :
1° Le matériel d'extinction et de secours qui se trouve dans le local ou à ses abords ;
2° Les personnes chargées de mettre ce matériel en action ;
3° Pour chaque local, les personnes chargées de diriger l'évacuation des travailleurs et éventuellement du public ;
4° Les mesures spécifiques liées à la présence de personnes handicapées, et notamment le nombre et la localisation des espaces d'attentes sécurisés ou des espaces équivalents ;
5° Les moyens d'alerte ;
6° Les personnes chargées d'aviser les sapeurs-pompiers dès le début d'un incendie ;
7° L'adresse et le numéro d'appel téléphonique du service de secours de premier appel, en caractères apparents ;
8° Le devoir, pour toute personne apercevant un début d'incendie, de donner l'alarme et de mettre en œuvre les moyens de premier secours, sans attendre l'arrivée des travailleurs spécialement désignés.";2011-1461;2011-11-07;2011
Titre II : Obligations de l'employeur pour l'utilisation des lieux de travail  (Articles R4221-1 à R4228-37);Chapitre VII : Risques d'incendies et d'explosions et évacuation (Articles R4227-1 à R4227-57);Section 5 : Moyens de prévention  et de lutte contre l'incendie (Articles R4227-28 à R4227-41);Article R4227-39;"Modifié par Décret n°2011-1461
 du 7 novembre 2011 - art. 8";"La consigne de sécurité incendie prévoit des essais et visites périodiques du matériel et des exercices au cours desquels les travailleurs apprennent à reconnaître les caractéristiques du signal sonore    d'alarme générale, à localiser et à utiliser les espaces d'attente sécurisés ou les espaces équivalents à se servir des moyens de premier secours et à exécuter les diverses manœuvres nécessaires.
Ces exercices et essais périodiques ont lieu au moins tous les six mois. Leur date et les observations auxquelles ils peuvent avoir donné lieu sont consignées sur un registre tenu à la disposition de l'inspection du travail.";2011-1461;2011-11-07;2011
Titre II : Obligations de l'employeur pour l'utilisation des lieux de travail  (Articles R4221-1 à R4228-37);Chapitre VII : Risques d'incendies et d'explosions et évacuation (Articles R4227-1 à R4227-57);Section 5 : Moyens de prévention  et de lutte contre l'incendie (Articles R4227-28 à R4227-41);Article R4227-40;Création Décret n°2008-244 du 7 mars 2008 - art. (V);La consigne de sécurité incendie est communiquée à l'inspection du travail.;2008-244;2008-03-07;2008
Titre II : Obligations de l'employeur pour l'utilisation des lieux de travail  (Articles R4221-1 à R4228-37);Chapitre VII : Risques d'incendies et d'explosions et évacuation (Articles R4227-1 à R4227-57);Section 5 : Moyens de prévention  et de lutte contre l'incendie (Articles R4227-28 à R4227-41);Article R4227-41;Création Décret n°2008-244 du 7 mars 2008 - art. (V);Des arrêtés conjoints des ministres chargés du travail et de l'agriculture peuvent préciser certaines dispositions relatives aux moyens de prévention et de lutte contre l'incendie et rendre obligatoires certaines normes concernant ce matériel.;2008-244;2008-03-07;2008
Titre II : Obligations de l'employeur pour l'utilisation des lieux de travail  (Articles R4221-1 à R4228-37);Chapitre VII : Risques d'incendies et d'explosions et évacuation (Articles R4227-1 à R4227-57);Section 6 : Prévention des explosions (Articles R4227-42 à R4227-54);Article R4227-42;Création Décret n°2008-244 du 7 mars 2008 - art. (V);"Les dispositions de la présente section ne s'appliquent pas aux lieux ou activités suivants :
1° Zones servant directement au traitement médical de patients et pendant celui-ci ;
2° Utilisation des appareils à gaz ;
3° Fabrication, maniement, utilisation, stockage et transport d'explosifs et de substances chimiques instables.";2008-244;2008-03-07;2008
Titre II : Obligations de l'employeur pour l'utilisation des lieux de travail  (Articles R4221-1 à R4228-37);Chapitre VII : Risques d'incendies et d'explosions et évacuation (Articles R4227-1 à R4227-57);Section 6 : Prévention des explosions (Articles R4227-42 à R4227-54);Article R4227-43;Création Décret n°2008-244 du 7 mars 2008 - art. (V);Est une atmosphère explosive, au sens de la présente section, un mélange avec l'air, dans les conditions atmosphériques, de substances inflammables sous forme de gaz, vapeurs, brouillards ou poussières, dans lequel, après inflammation, la combustion se propage à l'ensemble du mélange non brûlé.;2008-244;2008-03-07;2008
Titre II : Obligations de l'employeur pour l'utilisation des lieux de travail  (Articles R4221-1 à R4228-37);Chapitre VII : Risques d'incendies et d'explosions et évacuation (Articles R4227-1 à R4227-57);Section 6 : Prévention des explosions (Articles R4227-42 à R4227-54);Article R4227-44;Création Décret n°2008-244 du 7 mars 2008 - art. (V);"Afin d'assurer la prévention des explosions et la protection contre celles-ci, l'employeur prend les mesures techniques et organisationnelles appropriées au type d'exploitation sur la base des principes de prévention et dans l'ordre de priorité suivant :
1° Empêcher la formation d'atmosphères explosives ;
2° Si la nature de l'activité ne permet pas d'empêcher la formation d'atmosphères explosives, éviter leur inflammation ;
3° Atténuer les effets nuisibles d'une explosion pour la santé et la sécurité des travailleurs.";2008-244;2008-03-07;2008
Titre II : Obligations de l'employeur pour l'utilisation des lieux de travail  (Articles R4221-1 à R4228-37);Chapitre VII : Risques d'incendies et d'explosions et évacuation (Articles R4227-1 à R4227-57);Section 6 : Prévention des explosions (Articles R4227-42 à R4227-54);Article R4227-45;Création Décret n°2008-244 du 7 mars 2008 - art. (V);"Les mesures prises par l'employeur sont, au besoin, combinées et complétées avec des mesures destinées à prévenir la propagation des explosions.
Elles font l'objet d'un réexamen périodique et chaque fois que se produisent des changements importants dans les conditions d'exécution du travail.";2008-244;2008-03-07;2008
Titre II : Obligations de l'employeur pour l'utilisation des lieux de travail  (Articles R4221-1 à R4228-37);Chapitre VII : Risques d'incendies et d'explosions et évacuation (Articles R4227-1 à R4227-57);Section 6 : Prévention des explosions (Articles R4227-42 à R4227-54);Article R4227-46;Création Décret n°2008-244 du 7 mars 2008 - art. (V);"L'employeur évalue les risques créés ou susceptibles d'être créés par des atmosphères explosives en tenant compte au moins :
1° De la probabilité que des atmosphères explosives puissent se présenter et persister ;
2° De la probabilité que des sources d'inflammation, y compris des décharges électrostatiques, puissent se présenter et devenir actives et effectives ;
3° Des installations, des substances et préparations utilisées, des procédés et de leurs interactions éventuelles ;
4° De l'étendue des conséquences prévisibles d'une explosion.";2008-244;2008-03-07;2008
Titre II : Obligations de l'employeur pour l'utilisation des lieux de travail  (Articles R4221-1 à R4228-37);Chapitre VII : Risques d'incendies et d'explosions et évacuation (Articles R4227-1 à R4227-57);Section 6 : Prévention des explosions (Articles R4227-42 à R4227-54);Article R4227-47;Création Décret n°2008-244 du 7 mars 2008 - art. (V);L'évaluation des risques d'explosion est globale et, le cas échéant, combinée avec les résultats de l'évaluation des autres risques, identifiés dans chaque unité de travail de l'entreprise ou de l'établissement.;2008-244;2008-03-07;2008
